{
  "schemaVersion": "1.0",
  "revision": "405c186067144ea0e0ffb3dba8b90482611c50b1",
  "previousPassingRevision": null,
  "workflow": "customer-ready-release-gate",
  "executor": "local-script",
  "producer": "scripts/run-customer-ready-gate.mjs",
  "producerDigest": "sha256:eb68ff2df183aac7e64b048d8b20cff074c826f4e80922f948608a301e7d4bff",
  "transcriptPath": "architecture/evidence/customer-ready-gates/405c186067144ea0e0ffb3dba8b90482611c50b1.log",
  "transcriptDigest": "sha256:b6a453bf4e58af9bdc98cc67e2d5c6de2eb85113e875784fec6b412832453b72",
  "startedAt": "2026-08-31T21:03:38.351Z",
  "executedAt": "2026-08-31T21:10:09.668Z",
  "verdict": "pass",
  "checks": [
    {
      "name": "credential-scan",
      "command": "npm run test:credential-scan",
      "exitCode": 0,
      "durationMs": 1103
    },
    {
      "name": "typecheck",
      "command": "npm run typecheck",
      "exitCode": 0,
      "durationMs": 1335
    },
    {
      "name": "architecture",
      "command": "npm run check:architecture",
      "exitCode": 0,
      "durationMs": 8991
    },
    {
      "name": "boundary",
      "command": "npm run test:boundary",
      "exitCode": 0,
      "durationMs": 25410
    },
    {
      "name": "build-web",
      "command": "TALLI_BACKEND_URL=http://127.0.0.1:8000 TALLI_MARKETING_MEASUREMENT_INTERNAL_KEY=<local-only> npm run build:web && npm run test:browser-public-acquisition:built",
      "exitCode": 0,
      "durationMs": 14885
    },
    {
      "name": "build-backend",
      "command": "npm run build:backend",
      "exitCode": 0,
      "durationMs": 989
    },
    {
      "name": "boundary-smoke",
      "command": "npm run test:boundary-smoke",
      "exitCode": 0,
      "durationMs": 6841
    },
    {
      "name": "launch-rehearsal",
      "command": "TALLI_PYTHON_BIN=.venv/bin/python TALLI_SKATTE_XSD_DIR=<pinned-v1.62.47> npm run test:launch-rehearsal",
      "exitCode": 0,
      "durationMs": 74053
    },
    {
      "name": "production-dependency-audit",
      "command": "npm audit --omit=dev --audit-level=high && npm audit --prefix apps/web --omit=dev --audit-level=high",
      "exitCode": 0,
      "durationMs": 1767
    },
    {
      "name": "database-isolation",
      "command": "TALLI_PYTHON_BIN=.venv/bin/python npm run test:supabase:local",
      "exitCode": 0,
      "durationMs": 234219
    },
    {
      "name": "whitespace",
      "command": "bash scripts/check-clean-worktree.sh",
      "exitCode": 0,
      "durationMs": 68
    }
  ]
}
